,score,title,availability,image,link,generos,pais,estreno,tags,fecha,duracion,sinopsis,audio,subtítulos,votos,reparto
0,7,Tokyo Shaking,Disponible hasta el 3 de agosto,https://static.filmin.es/images/media/38475/3/card_0_3_550x310.png,https://www.filmin.es/pelicula/tokyo-shaking,"Drama, Thriller",,15/10/21,"Estreno exclusivo, Cine apocalíptico, Survival Movie, Desastres naturales, Catástrofes, Diseccionando Japón, Tokio, Choque cultural, Burguesía, Mundo laboral, Nuclear, Grandes éxitos en suscripción",2021 , 1h 41min,"El incidente de Fukushima contado desde la perspectiva de una alta ejecutiva francesa trasladada a Tokyo las semanas previas al colapso. Trepidante y fascinante a partes iguales, ""Tokyo Shaking"" plantea los dilemas éticos, políticos y morales que asolaron Japón en 2011.

11 de marzo de 2011. El mayor terremoto que ha experimentado Tokio desencadena el desastre de Fukushima. Alexandra es una alta ejecutiva que acaba de llegar al país procedente de Francia para trabajar en un banco de prestigio. Sin saberlo, ella y su familia se tendrán que enfrentar a una crisis nuclear que tuvo al mundo en vilo.","Francés
Catalán
Español","Español
Catalán",1482 votos,"Karin Viard, Stéphane Bak, Yumi Narita, Philippe Uchan, Jean-François Cayrey, Charlie Dupont, Emilie Gavois-Kahn"
1,7.9,Al descubierto,Disponible hasta el 3 de agosto,https://static.filmin.es/images/media/44979/3/card_0_3_550x310.png,https://www.filmin.es/pelicula/al-descubierto,Drama,Estados Unidos,28/12/22,"1 Globos de Oro, Otros 5 premios o nominaciones, Basada en hechos reales, #MeToo, Cine de Denuncia, Periodismo, Abusos sexuales, Gente del cine, Mundo laboral, Feminismo, Revolución y Denuncia, Escándalo Sexual, Machismo, Cómo funciona Hollywood, Directoras",2022 , 2h 4min,"Drama protagonizado por Carey Mulligan (""Promising Young Woman"") y Zoe Kazan que destapa la investigación de las reporteras del New York Times contra Harvey Weinstein que desencadenó el movimiento #metoo.

En 2017 dos reporteras del New York Times, Megan Twohey y Jodi Kantor, publicaron una investigación periodística sobre los abusos sexuales del famoso productor Harvey Weinstein que desencadenó el movimiento #Metoo en todo el mundo y rompió décadas de silencio sobre el tema de las agresiones sexuales en Hollywood.","Inglés (Original)
Español",Español,143 votos,"Zoe Kazan, Carey Mulligan, Patricia Clarkson, Andre Braugher, Jennifer Ehle, Ashley Judd, Angela Yeoh, Maren Heary, Sean Cullen, Anastasia Barzee"
2,7.2,Maria Chapdelaine,Disponible hasta el 4 de agosto,https://static.filmin.es/images/media/42845/2/card_0_3_550x310.webp,https://www.filmin.es/pelicula/maria-chapdelaine,Drama,Canadá,02/08/22,"1 Le Gala Quebec Cinema, Otros 11 premios o nominaciones, Cine de Época, Drama de Época, Romance de época, Basado en una Novela, Romance, Vida Rural, Declaración de amor, Primer amor, Triángulo amoroso, Matrimonio, Relaciones Familiares",2022 , 2h 32min,"Una joven en la Canadá profunda de principios del siglo XX se enfrenta una difícil decisión: su familia o su futuro.

María Chapdelaine, una joven de 16 años, vive con su familia en un terreno cerca del río Péribonka en el Quebec rural de principios de 1900. Como verdaderos pioneros, la familia Chapdelaine se esfuerza por hacer retroceder el bosque. En un hogar en el que ni siquiera el agotamiento físico puede disminuir el calor de la vida familiar, María se encuentra ante un profundo dilema. François Paradis, un cazador de pieles y leñador de espíritu libre promete a María volver en primavera para casarse con ella, mientras que Lorenzo Surprenant llega a la granja ofreciéndole una existencia cómoda en una ciudad estadounidense.","Francés
Español",Español,35 votos,"Sara Montpetit, Sébastien Ricard, Hélène Florent, Antoine-Olivier Pilon, Emile Schneider, Robert Naylor, Martin Dubreuil, Gabriel Arcand, Gilbert Sicotte, Charlotte St-Martin"
3,7.4,Julia,Disponible hasta el 6 de agosto,https://static.filmin.es/images/media/3926/1/card_0_3_550x310.webp,https://www.filmin.es/pelicula/julia,Thriller,Francia,27/02/09,"1 Festival de Berlín, Otros 6 premios o nominaciones, Thriller Psicológico, Autodestrucción, Assholes, Alcoholismo, Crimen y Delincuencia, Violencia, Secuestro, Amistad entre joven y adulto",2008 , 2h 18min,"Tilda Swinton se convierte en un personaje despreciable en este fascinante thriller reminiscente de ""Gloria"" de John Cassavetes que narra la relación que se establece entre un niño y su secuestradora.

Julia tiene 40 años y es alcohólica, manipuladora, mentirosa e insegura a pesar de su flamante apariencia. Entre tragos de vodka y citas nocturnas, Julia sobrevive a base de pequeños trabajos, pero cada vez está más sola y las únicas atenciones que recibe provienen de su amigo Mitch, que trata de ayudarla aunque ella lo evite. Mientras, el alcohol va reforzando su idea de que la vida le ha repartido malas cartas y que ella no tiene la culpa del desastre en que ésta se ha convertido. Previendo una perdición inminente y tras un encuentro casual con Elena, una mujer mejicana, Julia se convence, movida por el pánico y su delicada situación económica, para cometer un acto violento.","Español
Inglés",Español,318 votos,"Tilda Swinton, Saul Rubinek, Kate del Castillo, Bruno Bichir, Mauricio Moreno, Jude Ciccolella, Gaston Peterson, Kevin Kilner"
4,6.2,Blood Father,Disponible hasta el 6 de agosto,https://static.filmin.es/images/media/16738/3/card_0_3_550x310.webp,https://www.filmin.es/pelicula/blood-father,"Acción, Thriller",Francia,09/09/16,"1 Festival de Cannes, Grandes Estrenos, Día del padre, Narcotráfico, Cine de Persecuciones, Road Movie, Road Movie USA, Humor Negro, Violencia, Relación Padre Hijo, Motos",2016 , 1h 24min,"Un thriller enérgico y rabioso que se muestra diestro coreografiando secuencias de acción y acumulando tensión antes de desatar la furia. Mel Gibson vuelve a su mejor versión.

Después de que su novio traficante de drogas le tienda una trampa tras robar una fortuna a un cártel, Lydia (Erin Moriarty), una joven de 18 años, se ve obligada a escapar. En su huida, solo encontrará un aliado: su desastroso padre, John Link (Mel Gibson), un borracho, ex convicto que desea ejercer de buen progenitor. Ahora tiene la oportunidad de hacer lo correcto y salvar la vida de su hija, aunque ello ponga en peligro la suya.","Español
Inglés",,299 votos,"Mel Gibson, Erin Moriarty, Diego Luna, William H. Macy, Michael Parks"
5,6.6,Eight for Silver,Disponible hasta el 6 de agosto,https://static.filmin.es/images/media/45299/1/card_0_3_550x310.png,https://www.filmin.es/pelicula/eight-for-silver,Terror,Estados Unidos,,"1 Festival de Sundance, Otros 3 premios o nominaciones, Terror Gótico, Cine de Época, Animales salvajes, Monstruos, Animales Monstruosos, Desapariciones, Brujería, Espíritus",2021 , 1h 47min,"Una regreso al terror clásico dándole una vuelta a los elementos del género: hombres lobo, maldiciones, brujería... Con una ambientación espectacular, esta joya de terror gótico atemoriza a cualquiera.

A finales del siglo XIX, un hombre llega a una aldea remota para investigar el ataque de un animal salvaje, pero descubre una fuerza mucho más grande y siniestra que tiene a la mansión y a sus habitantes sometidos.","Inglés (Original)
Español",Español,28 votos,"Boyd Holbrook, Kelly Reilly, Alistair Petrie, Roxane Duran, Nigel Betts, Stuart Bowman, Simon Kunz, Amelia Crouch"
6,6.1,January,Disponible hasta el 6 de agosto,https://static.filmin.es/images/media/46228/4/card_0_3_550x310.webp,https://www.filmin.es/pelicula/january,"Drama, Thriller",Letonia,,"1 Premios Óscar, Otros 21 premios o nominaciones, AMFF 2023, AMFF 2023 - Sección Oficial, Ambientadas en los años 90, Cine de Denuncia, Unión Soviética, Revolución y Denuncia, Amistad, Grupo de amigos, Comunismo, Found Footage, Autobiográfica, Veinteañeros, Metacine, En las aulas, Basada en hechos reales, Subtítulos en inglés",2022 , 1h 33min,"Candidata por Letonia a los premios Óscar. La película que mejor ensalza al cine como acto de resistencia pacífica. Un drama semiautobiográfico que cuenta las experiencias de un grupo de cineastas adolescentes cuando la Unión Soviética intentó ocupar los países bálticos.

Letonia, 1991. La vida del aspirante a cineasta Jazis, de diecinueve años, y la de sus amigos se ve sumida en el caos cuando son arrastrados a las protestas pacíficas de todo el pueblo letón contra el intento de toma del poder por parte del ejército soviético en su país. Su experiencia y participación en la resistencia no violenta a través de la construcción de barricadas y escudos humanos se convierte en el momento definitivo de su mayoría de edad.",Varios (Original),"Español
Inglés",8 votos,"Karlis Arnolds Avots, Baiba Broka, Rudolfs Cirulis, Alise Danovska, Aleksas Kazanavicius, Sandis Runge, Juhan Ulfsak"
7,8.1,Dalva,Disponible hasta el 6 de agosto,https://static.filmin.es/images/media/46229/8/card_0_3_550x310.png,https://www.filmin.es/pelicula/dalva,Drama,Bélgica,,"1 European Film Awards, Otros 21 premios o nominaciones, AMFF 2023, AMFF 2023 - Sección Oficial, Ópera Prima, Drama Psicológico, Coming of age, Infancia y Adolescencia, Relación Padre Hijo, Abusos a menores, Incesto, Infancia marginal, Teen Angst, Directoras, Subtítulos en inglés",2022 , 1h 25min,"El conmovedor debut de la directora Emmanuelle Nicot, un crudo drama sobre una niña obligada a creerse mujer con tan sólo 12 años. Ha arrasado en festivales como Rotterdam o la Semana de la Crítica del Festival de Cannes.

Aunque Dalva tiene 12 años, se viste, se maquilla y vive como una mujer. Una noche, de repente se la llevan de la casa familiar. Atónita e indignada al principio, luego conoce a Jayden, un trabajador social, y a Samia, una adolescente con mal genio. Una nueva vida parece comenzar para Dalva, la de una niña de su edad.",Francés (Original),"Español
Inglés",463 votos,"Zelda Samson, Alexis Manenti, Fanta Guirassy, Marie Denarnaud, Jean-Louis Coulloc'h, Sandrine Blancke, Maia Sandoz, Charlie Drach, Babetida Sadjo"
8,7.4,Safe Place,Disponible hasta el 6 de agosto,https://static.filmin.es/images/media/46230/2/card_0_3_550x310.png,https://www.filmin.es/pelicula/safe-place,Drama,Croacia,,"1 Premios Óscar, Otros 17 premios o nominaciones, AMFF 2023, AMFF 2023 - Sección Oficial, Basada en hechos reales, Drama Psicológico, Ópera Prima, Suicidio, Salud Mental, Relación entre Hermanos, Autoficción, Actor Director, Relaciones Familiares, Relaciones Sentimentales, Subtítulos en inglés",2022 , 1h 43min,"Candidata al Óscar por Croacia y Mejor Película Internacional en AMFF 2023. Una obra desgarrada que analiza las consecuencias de un suicidio en una familia: dos hermanos, una madre. Triángulo emocional que interpretan unos actores en estado de gracia. La película sobre salud mental más relevante de la temporada.

Un evento traumático - un intento de suicidio - abre una grieta en la existencia cotidiana de una familia. Sus vidas cambian drásticamente, como si estuvieran librando una guerra invisible con todos los demás.",Croata (Original),"Español
Inglés",99 votos,"Juraj Lerotic, Goran Markovic, Snjezana Sinovcic, Damir Klemenic, Biljana Toric, Neven Aljinovic-Tot, Jasmin Mekic, Suncana Zelenika, Mario Knezovic"
9,8.5,Aurora's Sunrise,Disponible hasta el 6 de agosto,https://static.filmin.es/images/media/46231/5/card_0_3_550x310.webp,https://www.filmin.es/pelicula/auroras-sunrise,"Animación, Documental, Biopic",,,"1 Premios Óscar, Otros 13 premios o nominaciones, AMFF 2023, AMFF 2023 - Sección Oficial, Ópera Prima, Biopic de Cine, Biopic Mujeres Extraordinarias, Documental de animación, Documentales sobre Mujeres de referencia, Mezcla Documental / Ficción, Genocidio, Esclavitud, Animación Europea, Animación para Adultos, Gente del cine, Found Footage, Mujeres Guerreras, Cine Mudo, Directoras, Lección de Historia, Subtítulos en inglés",2022 , 1h 36min,"Candidata por Armenia en los Óscar. Una joya animada inspirada por el bello Art Noveau que rescata la increíble historia real de Aurora Mardiganian. Conocida como la Juana de Arco de Armenia fue una mujer que, tras sobrevivir de forma milagrosa a la masacre del Genocidio Armenio y vivir las situaciones más inimaginables, terminó codeándose con el star system del Hollywood mudo mientras denunciaba el infierno que se vivía en su país.

Una superviviente del genocidio se convierte en una estrella del cine mudo: la odisea de Aurora Mardiganian es casi irreal. Después de perder a su familia, escapar de la esclavitud y soportar la codicia de Hollywood. Ella viaja lejos para contarle al mundo sobre el Genocidio Armenio.",Varios (Original),"Español
Inglés",90 votos,"Aurora Mardiganian, Anzhelika Hakobyan"
10,6.9,To The North,Disponible hasta el 6 de agosto,https://static.filmin.es/images/media/46267/4/card_0_3_550x310.webp,https://www.filmin.es/pelicula/to-the-north,"Thriller, Drama",,,"1 Festival de Venecia, Otros 6 premios o nominaciones, AMFF 2023, AMFF 2023 - Sección Oficial, Ópera Prima, Basada en hechos reales, Ambientadas en los años 90, Cine Social, Cine de Denuncia, Barco, Mar, Inmigración, Capitalismo, Religión, Pocos Personajes y Localizaciones, Subtítulos en inglés",2022 , 2h 2min,"Thriller a bordo de un barco de mercancías en el que un emigrante rumano tendrá que permanecer escondido de la inclemente tripulación. Basada en una historia real ocurrida en los años 90.

1996, mar abierto. Durante su turno en la cubierta de un transatlántico, Joel, un religioso marinero filipino, descubre a Dumitru, un polizón rumano escondido entre unos contenedores. Si los oficiales taiwaneses que manejan el barco le ven, Dumitru corre el riesgo de ser arrojado por la borda. Joel decide esconderlo, como muestra de su gratitud hacia Dios. Cuando su tripulación, sus propios amigos, e incluso el propio Dios comienzan a darle la espalda, Joel deberá enfrentarse solo a su destino.",Varios (Original),"Inglés
Español",35 votos,"Soliman Cruz, Nikolai Becker, Bart Guingona, Alexandre Nguyen, Olivier Ho Hio Hen, Dimitar Vasilev, Noel Sto. Domingo, Olivier Chen"
11,7.2,Thunder,Disponible hasta el 6 de agosto,https://static.filmin.es/images/media/46272/5/card_1_3_550x310.png,https://www.filmin.es/pelicula/thunder,Drama,Suiza,,"1 Festival de San Sebastián, Otros 12 premios o nominaciones, AMFF 2023, AMFF 2023 - Sección Oficial, Ópera Prima, Cine de Época, Drama de Época, Vida Rural, Romance de época, Despertar Sexual, Religión, Infancia y Adolescencia, Sexo, Triángulo amoroso, Teen Angst, Primer amor, Romance, Existencialismo, Directoras, Subtítulos en inglés",2022 , 1h 33min,"La película suiza más premiada del año. En un pequeño pueblo suizo de principios de siglo XX, un grupo de jóvenes se entregan al fervor del placer en un despertar sexual que nunca olvidarán. Una evocadora fábula sobre la libertad sexual que se alza como un alegato contra la represión del deseo en un contexto ahogado por la moral religiosa.

Verano de 1900, Suiza. La repentina muerte de su hermana mayor obliga a Elisabeth a regresar a casa. Asfixiada por las estrictas normas del pueblo, Elisabeth se ve poco a poco forzada a rebelarse por su derecho a vivir su vida.",Francés (Original),"Inglés
Español",99 votos,"Lilith Grasmug, Sabine Timoteo, Mermoz Melchior, François Revaclier, Noah Watzlawick, Marco Calamandrei, Diana Gervalla, Benjamin Python"
12,6.3,Neon Spring,Disponible hasta el 6 de agosto,https://static.filmin.es/images/media/46277/6/card_1_3_550x310.webp,https://www.filmin.es/pelicula/neon-spring,Drama,Letonia,,"1 Atlàntida Mallorca Film Fest, Otros 5 premios o nominaciones, AMFF 2023, AMFF 2023 - Sección Oficial, Drama Psicológico, Fiesta, Noche de fiesta, Drogas, Autodestrucción, Relaciones Familiares, Relación entre Hermanos, Relación Padre Hijo, Infancia y Adolescencia, LGTBI+, Cine Lésbico, Salud Mental, Subtítulos en inglés",2022 , 1h 42min,"Fiesta, drogas y techno en una rave que nunca acaba. Co-escrita por su joven actriz protagonista, “Neon Spring” es el íntimo retrato de una chica que busca su lugar en el mundo y lo encuentra en estas particulares veladas de amor y descontrol. Una visión de la experiencia adolescente innovadora, fresca y decididamente cool. Para todos aquellos que aún esperan la nueva temporada de “Euphoria”.

Mientras su familia se desmorona, Laine, de veinte años, se introduce en la escena de las raves clandestinas de Riga, donde experimenta un inframundo de drogas, libertad y sexo hasta que poco a poco empieza a perder la conexión con la realidad.",Letón (Original),"Español
Inglés",20 votos,"Marija Luize Melke, Greta Trusina, Gerds Laposka, Agnese Ruksane, Janis Skutelis, Matiss Ozols, Timotejs Pelle Kalnins, Arnis Ritups"
13,6.9,Delegation,Disponible hasta el 6 de agosto,https://static.filmin.es/images/media/46280/5/card_1_3_550x310.webp,https://www.filmin.es/pelicula/delegation,Drama,,,"1 Festival de Berlín, Otros 1 premios o nominaciones, AMFF 2023, AMFF 2023 - Sección Oficial, Ópera Prima, Cine Político, En las aulas, Road Movie, Holocausto, Amistad, Vacaciones, Memoria Histórica, Campos de Concentración, Infancia y Adolescencia, Nazismo, Lección de Historia",2023 , 1h 38min,"Tras pasar por el Festival de Berlín, nos llega esta visión singular sobre la relación entre juventud y memoria. Tres jóvenes israelíes se van de viaje de fin de curso a los monumentos más emblemáticos del Holocausto en Polonia. Esta será la última vez que estén juntos antes de ir al ejército para su formación militar.

Tres jóvenes amigos israelíes participan en un viaje de estudios visitando los sitios del Holocausto en Polonia, siendo esta la última vez que se encontrarán juntos antes de ir al ejército. Durante el viaje Frisch, un chico tímido, Nitzan, una aspirante a artista y el rompecorazones de la clase Ido tratan temas de amor, amistad y política en el contexto de los campos de concentración y los monumentos conmemorativos. Un viaje que los cambiará para siempre.",Hebreo (Original),Español,23 votos,"Yoav Bavly, Naomi Harari, Leib Levin, Etai Avital, Karolina Bruchnicka, Aviv Buchler, Ezra Dagan, Alma Dishi, Lech Dyblik, Pascal Fischer, Tomira Kowalik"
14,3.9,Inland,Disponible hasta el 6 de agosto,https://static.filmin.es/images/media/46296/4/card_0_3_550x310.webp,https://www.filmin.es/pelicula/inland,"Drama, Terror, Thriller",Reino Unido,,"1 Atlàntida Mallorca Film Fest, Otros 1 premios o nominaciones, AMFF 2023, AMFF 2023 - Sección Oficial, Ópera Prima, Drama Psicológico, Terror Psicológico, Terror Británico, Existencialismo, Duelo/Luto, Reencuentros, Amistad, Personaje con incomunicación, Desapariciones, Relación Madre Hijo, Subtítulos en inglés",2023 , 1h 22min,"Con ecos del cine de David Lynch o Nicolas Roeg, este enigmático cuento de hadas moderno explora la identidad fracturada de un joven tras la misteriosa desaparición de su madre. Un jovencísimo debut aclamado por la crítica y protagonizado por el ganador del Óscar, Mark Rylance, protagonista de ""El puente de los espías"".

Un joven de ascendencia romaní regresa a su ciudad natal de Gloucester. Lo recibe el mecánico de garaje local, Dunleavy. Se abrazan, sonriendo. Pero, ¿qué pasado lleva consigo el joven? ¿Qué le espera de regreso entre personas que realmente no entiende y que no lo entienden a él? ¿Y qué acecha en el bosque, observando, silencioso, viejo como los árboles?",Inglés (Original),"Español
Inglés",14 votos,"Mark Rylance, Rory Alexander, Kathryn Hunter, Shaun Dingwall, Alexander Lincoln, Nell Williams, Jake Gwilliam, Sebastian Orozco"
15,6.8,Chiara,Disponible hasta el 6 de agosto,https://static.filmin.es/images/media/46298/5/card_0_3_550x310.webp,https://www.filmin.es/pelicula/chiara,Biopic,,,"6 Festival de Venecia, Otros 3 premios o nominaciones, AMFF 2023, AMFF 2023 - Sección Oficial, Cine Religioso, Biopic Religioso, Biopic Mujeres Extraordinarias, Basada en hechos reales, Monjas, Revolución, Religión, Feminismo, Controversia religiosa, Mujeres Guerreras, Subtítulos en inglés",2022 , 1h 46min,"La extraordinaria historia real de Clara de Asís, o cómo una joven de 18 años consiguió convertirse en Santa tras enfrentarse a la masculinidad religiosa y al mismísimo Papa. Una película de Susanna Nicchiarelli, directora de la celebrada ""Miss Marx"" participante en la Sección Oficial del Festival de Venecia.

Asís, 1211. Chiara tiene dieciocho años y una noche se escapa de casa para reunirse con su amigo Francesco: a partir de ese momento su vida cambia para siempre. Con carisma y convicción se libera de las ataduras de su acomodada familia y llega a enfrentarse al mismísimo Papa. Por ella, por las mujeres que la acompañan y por su sueño de libertad. La historia de un Santo. La historia de una niña y su revolución.",Varios (Original),"Inglés
Español",65 votos,"Margherita Mazzucco, Andrea Carpenzano, Carlotta Natoli, Paola Tiziana Cruciani, Luigi Lo Cascio"
16,5.6,Pensive,Disponible hasta el 6 de agosto,https://static.filmin.es/images/media/46378/5/card_0_3_550x310.png,https://www.filmin.es/pelicula/pensive,"Terror, Thriller",Lituania,,"1 Festival de Torino, Otros 4 premios o nominaciones, AMFF 2023, AMFF 2023 - Sección Oficial, Ópera Prima, Slasher, Asesino en serie, Verano, Violencia, Amistad, Veinteañeros, Asesinato, Muerte, Noche de fiesta, Instituto, Teen Angst, Subtítulos en inglés",2022 , 1h 25min,"Un brutal slasher que reúne a un grupo de alocados adolescentes en una fiesta de graduación donde correrá el alcohol y también la sangre. A su vez, una reflexión sobre el respeto por el patrimonio.

Después de que los compañeros de clase destruyen estatuas de arte popular de madera de tamaño real durante una salvaje fiesta de graduación de la escuela secundaria en una cabaña remota, un misterioso asesino comienza a eliminarles uno por uno.",Lituano (Original),"Español
Inglés",51 votos,"Sarunas Rapolas Meliesius, Gabija Bargailaite, Marius Repsys, Donatas Simukauskas, Kipras Masidlauskas, Povilas Jatkevicius, Martynas Berulis, Justinas Gircys, Inga Puriuskyte, Saule Rasimaite"
17,6.3,The Gravity,Disponible hasta el 6 de agosto,https://static.filmin.es/images/media/46394/5/card_0_3_550x310.png,https://www.filmin.es/pelicula/the-gravity,"Ciencia ficción, Acción, Drama",Francia,,"1 Festival de Toronto, Otros 4 premios o nominaciones, AMFF 2023, AMFF 2023 - Sección Oficial, Cine Social, Bandas Callejeras, Delincuencia Juvenil, París, Narcotráfico, Drogas, Suburbios, Crimen y Delincuencia, Violencia, Cine apocalíptico, Espacio Exterior, Relación entre Hermanos, Subtítulos en inglés",2022 , 1h 26min,"¿Qué pasaría si a una película de bandas le sumamos el realismo social de los suburbios parisinos y una buena dosis de fantástico? ""The Gravity"" tiene la respuesta. Una película de ciencia ficción definitivamente callejera que puede recordar tanto a ""Los Miserables"" de Ladj Ly como al cine del mítico John Carpenter.

Una alineación sin precedentes de planetas que impactan en la gravedad alterará el equilibrio de un gueto y el destino de dos dúos de hermanos deseosos de hacer cualquier cosa por su libertad en una lucha incesante entre viejas y nuevas generaciones.",Francés (Original),"Español
Inglés
Catalán",67 votos,"Max Gomis, Jean-Baptiste Anoumon, Steve Tientcheu, Olivier Rosemberg, Thierry Godard, Hafsia Herzi, Bilel Chegrani, Djilane Diawara, Ines Zahoré"
18,7.7,María y la película olvidada,Disponible hasta el 6 de agosto,https://static.filmin.es/images/media/46458/1/card_0_3_550x310.png,https://www.filmin.es/pelicula/maria-y-la-pelicula-olvidada,Documental,España,,"1 Atlàntida Mallorca Film Fest, AMFF 2023, AMFF 2023 - Balearics Largometrajes, Documental sobre Cine, Documental sobre Cine Español, Documentales sobre Mujeres de referencia, Lección de Historia, Rodada en las Islas Baleares, Documental Histórico, Olvidadas por la historia, Feminismo, Documental sobre Feminismo, Películas Cortas, Directoras",2023 , 1h 2min,"Hace unos años nadie la conocía y hoy se sospecha que fue la primera directora de cine sonoro en España. María Forteza y su película “Mallorca” hicieron historia y ha llegado la hora de explicarla.

¿Quién era esta pionera en los inicios del cine sonoro? Hasta ahora, nadie había oído hablar de ella.El talento artístico de María Forteza va más allá. Su nieto, Miguel Ángel, emprende un viaje personal y creativo con el objetivo de reconstruir la vida de su abuela en Mallorca, Barcelona y su exilio en Portugal después de la Guerra Civil.Durante su búsqueda, descubre que María Forteza era cantante de zarzuela y cuplé, pero también amenizaba con su voz las proyecciones de cine mudo, que empezaban a proliferar en aquel entonces. El mundo del espectáculo acompañaba al cine hasta la llegada del sonido, y María Forteza formaba parte íntimamente de ambos.",Varios (Original),Español,32 votos,"Max Gomis, Jean-Baptiste Anoumon, Steve Tientcheu, Olivier Rosemberg, Thierry Godard, Hafsia Herzi, Bilel Chegrani, Djilane Diawara, Ines Zahoré"
